{
  "schema_version": "2.0",
  "result": "pass",
  "contract_path": "contract/transfer_contract.json",
  "contract_sha256": "0000000000000000000000000000000000000000000000000000000000000000",
  "runner_sha256": "0000000000000000000000000000000000000000000000000000000000000000",
  "candidate_digest_before": "0000000000000000000000000000000000000000000000000000000000000000",
  "candidate_digest_after": "0000000000000000000000000000000000000000000000000000000000000000",
  "matrix_completed": ["390x844@mobile-headless"],
  "source_artifacts": [
    {"path": "source/input.original", "sha256": "0000000000000000000000000000000000000000000000000000000000000000"},
    {"path": "source/input.h2d", "sha256": "0000000000000000000000000000000000000000000000000000000000000000"},
    {"path": "source/input.sha256", "sha256": "0000000000000000000000000000000000000000000000000000000000000000"},
    {"path": "source/h2d_decoded.json", "sha256": "0000000000000000000000000000000000000000000000000000000000000000"},
    {"path": "source/h2d_tree_index.json", "sha256": "0000000000000000000000000000000000000000000000000000000000000000"}
  ],
  "reports": [{"path": "reports/node_validation.json", "sha256": "0000000000000000000000000000000000000000000000000000000000000000"}]
}
